id,userName,userImage,date,score,scoreText,url,title,text,Source,application,is_positive
11,Mila Indra Sari,https://lh3.googleusercontent.com/-yoGmtiqyGiI/AAAAAAAAAAI/AAAAAAAAAAA/AMZuuclJVopFPuh93n86dLrP0PoOO0VyUg/photo.jpg,8/11/2020 5:26,5,5,https://play.google.com/apps/publish?#ReviewDetailsPlace:p=id.co.bni.bnicall&reviewid=gp:AOqpTOEImyA7_dhWtZkRjKGWJZ2ZPfyBBEj9XJ7oCUKrXm3GicbaS3zmb4EtSgnlrfO8HtoXhU220WvzAXXHLSY,,Good aplikasi â¤ï¸â¤ï¸â¤ï¸â¤ï¸,Google Play,BNI Call,1
12,Andhiko Tanoyo,https://lh3.googleusercontent.com/a-/AOh14Giay0FNDV4_XHQQr2Vm0xencOmVNbUkBXwK4TAuqQ,8/11/2020 4:33,5,5,https://play.google.com/apps/publish?#ReviewDetailsPlace:p=id.co.bni.bnicall&reviewid=gp:AOqpTOHo0X4mlzMXcu0HR-vn6xipDpwDWwJyrIniWI9ckb5hDGda0yBwFQnf1WD91vb6MaUQD0kEthBRLAT3nAI,,Aplikasi cerdas yg sangat membantu para nasabah muda generasi millenial yg modern dan digital oriented... Semoga BNI semakin berkembang dan jaya selalu... Aamiin,Google Play,BNI Call,1
13,noz sulistyawati,https://lh3.googleusercontent.com/a-/AOh14Gg-rkZqdm5Ybnl0C9Eh7IDMc4fY7DHJiGcIC62e,8/11/2020 3:55,5,5,https://play.google.com/apps/publish?#ReviewDetailsPlace:p=id.co.bni.bnicall&reviewid=gp:AOqpTOECtpOlfbuc804TpNM6HneetHKTVNGKNPmZYo-S4s_EiPFo17siIwgIGXVeHImrTvryQoqCu3NNwmc5EZI,,Aplikasi keren banget cuma pakai voice note ajah transfer jadi lancar,Google Play,BNI Call,1
14,Eko P,https://lh3.googleusercontent.com/-g3zqrsUVW1E/AAAAAAAAAAI/AAAAAAAAEXY/AMZuuclQzi9zEWMrmNABtw5ic7XcBQkiOw/photo.jpg,8/11/2020 3:49,5,5,https://play.google.com/apps/publish?#ReviewDetailsPlace:p=id.co.bni.bnicall&reviewid=gp:AOqpTOHYtTsUgkA5RdOysI32NEhPhLtf-iQfLMqk_U93fP-kzCm0FMXFI9sysw2CtAfx30E9tavO__od6cLncAk,,Sangat membantu ðŸ‘,Google Play,BNI Call,1
15,nabila rentcar,https://lh3.googleusercontent.com/a-/AOh14GhwhI72OMlNeNRBU7s99pO_VmbMzq2GWW0Iwylq,8/11/2020 3:49,5,5,https://play.google.com/apps/publish?#ReviewDetailsPlace:p=id.co.bni.bnicall&reviewid=gp:AOqpTOHS9dpEaPULMvi02iC95-b0DOPfcJ9PsuchgW9scui3G6l3tNpvpSj0WsG4YFHQyqKv-HZOT_cuyHMZrGU,,Keren bgt..dilanjutkan,Google Play,BNI Call,1
16,Lia Lestari,https://lh3.googleusercontent.com/a-/AOh14Ghep3iq96pru4huqt91sFl5yjktYdK0OVW2OCsQ,8/11/2020 3:31,5,5,https://play.google.com/apps/publish?#ReviewDetailsPlace:p=id.co.bni.bnicall&reviewid=gp:AOqpTOHfRQNNnIrNrJ088Ckuw4DEx8-IY83_b44xLdBDpL4b-FSJy0ZN_fvWo-mCDX-qsBYrk9Ci8FMYaSM0kyA,,Thank you,Google Play,BNI Call,1
17,Ira Maya,https://lh3.googleusercontent.com/-vhiBrlTsNKQ/AAAAAAAAAAI/AAAAAAAAAAA/AMZuuck5g9TrudI1coldF6DfHg5b6Jn0Nw/photo.jpg,8/11/2020 3:06,5,5,https://play.google.com/apps/publish?#ReviewDetailsPlace:p=id.co.bni.bnicall&reviewid=gp:AOqpTOHoOPGs-qiwwdPNNCuDkb89UwRrYhLWbYdAkCWbB5cgqm7_QSEJx0mdv14Rs2aa3vyQmwzelWXM774uQq8,,Keren...,Google Play,BNI Call,1
18,kartika suri,https://lh3.googleusercontent.com/-cBZbpf5ml9w/AAAAAAAAAAI/AAAAAAAAAAA/AMZuuckwjAFsUEf0IZzcUKW5q-CoVuBPGw/photo.jpg,8/11/2020 2:58,5,5,https://play.google.com/apps/publish?#ReviewDetailsPlace:p=id.co.bni.bnicall&reviewid=gp:AOqpTOFCFj4d9k1yYIO6ULdFWMhdSgy49HIdVWiqErxN1-QIec0x1Iuh9Feooo1nBUw7sYN9epBzntvZdQkj5TE,,Aplikasi nya bagus sdh lengkap ðŸ‘ðŸ‘,Google Play,BNI Call,1
19,byson merah,https://lh3.googleusercontent.com/-paapnqVkslY/AAAAAAAAAAI/AAAAAAAAAAA/AMZuucm7HxxkhsIDHftEauqPcPHjElLnbg/photo.jpg,8/11/2020 2:56,5,5,https://play.google.com/apps/publish?#ReviewDetailsPlace:p=id.co.bni.bnicall&reviewid=gp:AOqpTOHoWLuJFIm83zCXb64joIV_L0SQ-mob36yuEDyMleajFR5HHPcYVjUpme02YnG97t-t2zW-V9Od6vZ1cxQ,,Mantabbbb,Google Play,BNI Call,1
20,duo. b,https://lh3.googleusercontent.com/a-/AOh14GiZPNOVZS1BQmyD3KPbreZsXHjX0g8ylJjZ5LyGSQ,8/11/2020 2:55,5,5,https://play.google.com/apps/publish?#ReviewDetailsPlace:p=id.co.bni.bnicall&reviewid=gp:AOqpTOH5k3j46Z-cH4AMrci0kpSzyfq1Y1qyIViOHkjhpaRga3f06zik1VHvET4zDTjlb0bKqT-T86jCOPzuGIw,,Aplikasi nya futuristik.. Sangat membantu. Keep up the good work,Google Play,BNI Call,1
21,Eva Sulistiyawati,https://lh3.googleusercontent.com/-ynUUCJxea-c/AAAAAAAAAAI/AAAAAAAAAAA/AMZuuckvIXnQcvCLtTB8Hieb3uU6fK9mYA/photo.jpg,8/8/2020 8:05,5,5,https://play.google.com/apps/publish?#ReviewDetailsPlace:p=id.co.bni.bnicall&reviewid=gp:AOqpTOHEfX2k9V_cJkb39xnIIDuedOXlzDsr1pg5C8LAQahMhVTtzo2bui9y1ciGcc8eK2sOoSMRR4pybZI7o94,,goood,Google Play,BNI Call,1
22,Doni Kurniawan,https://lh3.googleusercontent.com/a-/AOh14GjbwVeOEF0AdJu2HpwKwurUgq0gj_cIeVZmfAgoSg,8/6/2020 2:32,5,5,https://play.google.com/apps/publish?#ReviewDetailsPlace:p=id.co.bni.bnicall&reviewid=gp:AOqpTOFXWxvIZ6zddeYoxSWD8Beey-I5oSW8hx-G9BpXRXPKsesKHFIkNGEcSXMeCqp-e780Yhbdy-LPd5XYdbs,,"Mantap aplikasinya, sudah bisa cek saldo juga. BNI Makin digital aja",Google Play,BNI Call,1
23,Ayu Taqwanita,https://lh3.googleusercontent.com/a-/AOh14GgwzFnZfaPavPNB2oltJuwOgA8XGK1I-cUhvL7J,8/6/2020 0:14,5,5,https://play.google.com/apps/publish?#ReviewDetailsPlace:p=id.co.bni.bnicall&reviewid=gp:AOqpTOGDFnVIAZSvHrFm0MfJbZYX2R43JqdT0nsNHYV2o9jW_ILESfdnxX2-11WeJmXciEVhbs0aYcxFqqCWM78,,Keren,Google Play,BNI Call,1
24,tomi rawlis,https://lh3.googleusercontent.com/-zCnrtdoOUlY/AAAAAAAAAAI/AAAAAAAAAAA/AMZuuckYIfl6hRifvjVxydT_sVSIzao2-g/photo.jpg,8/5/2020 15:40,5,5,https://play.google.com/apps/publish?#ReviewDetailsPlace:p=id.co.bni.bnicall&reviewid=gp:AOqpTOEVzvvyIoMnzRjX9GIGNml0OUcuOCnVYfwfU4a2VJbIR48Jg83ldBER5E_xVVBndyIUB7cfEbf7cgAjYn0,,Semoga bermanfaat,Google Play,BNI Call,1
25,Odank Mila,https://lh3.googleusercontent.com/a-/AOh14Ggvx8yw3c7ZSl6VnI4ILo8_RuLY6gzbo67kVGNMbg,8/5/2020 12:49,5,5,https://play.google.com/apps/publish?#ReviewDetailsPlace:p=id.co.bni.bnicall&reviewid=gp:AOqpTOH8IFEyDNlZWmUiwo4EqNqRTAd3TfabmZ6GMgFKNgE69-slUzYVGfKuJujtwcWzGbJ5R19tJsI-tJN3KWA,,Semakin baik ya BNI..,Google Play,BNI Call,1
26,melinda melinda,https://lh3.googleusercontent.com/-mQKh9PgcnG4/AAAAAAAAAAI/AAAAAAAAAAA/AMZuuckICng8Wlw6iA7FO9QT1uaFauJY2Q/photo.jpg,8/5/2020 10:25,5,5,https://play.google.com/apps/publish?#ReviewDetailsPlace:p=id.co.bni.bnicall&reviewid=gp:AOqpTOGEpVl8_AsJpec373Et6TRZqctM4AHpZT3MNy3Rt8G5-tHo92OkpIapgJq05xRM9Y4fvy133DgWhvft_mo,,Aplikasi yang oke bgt..very helpful ^^,Google Play,BNI Call,1
27,Leny Erisna Putri Renata,https://lh3.googleusercontent.com/a-/AOh14GgfqJSLHhGjAobW4gmBWMqtwHhUR-5QGoqq0u30DCg,7/18/2020 14:34,1,1,https://play.google.com/apps/publish?#ReviewDetailsPlace:p=id.co.bni.bnicall&reviewid=gp:AOqpTOFTuA6HnJqVxUkUmuiKOgKnXCkxBH5mirA1I8iCnQym0DDyVVqBEZaUWUuWHQ7Y3VoAmNpXmKut6XcAKoo,,Kupikir ini bisa live chat beneran. Omg. Tiap minta live chat malah ga jadi dihubungin. Terus ngejawab ga sesuai pertanyaan. Ujung2nya harus tetep nelpon. Ini gimana she,Google Play,BNI Call,0
28,Yogi Wira,https://lh3.googleusercontent.com/a-/AOh14GjfuzWMclXypdCl0c6rZdaQjHM2sC1JpUvXZuYuQg,7/17/2020 14:37,1,1,https://play.google.com/apps/publish?#ReviewDetailsPlace:p=id.co.bni.bnicall&reviewid=gp:AOqpTOHN_JuqfSlG8KbE0vT19Pk7S5-krgUGYCYpniSd-OwuUyr-6u8FG50wRrgVcPpxotzDhbWbJ_KY8NPUYdU,,"Apa ini, kita di arahkan telpon ke CS, tapi seminggu saya telepon tidak bisa tersambung. Sudah berapa lama ino perusahaan berdiri. Masih jelek sekali untuk pelaporan melalui telepon.",Google Play,BNI Call,0
29,ruffandi priyanto,https://lh3.googleusercontent.com/-FtWRgkJd0uw/AAAAAAAAAAI/AAAAAAAAAAA/AMZuuck1i2ASenqO9h-k0rPr-bXgU-vznA/photo.jpg,7/12/2020 22:21,4,4,https://play.google.com/apps/publish?#ReviewDetailsPlace:p=id.co.bni.bnicall&reviewid=gp:AOqpTOFiyZH_b1l6tLTExfiIcIjr7jvuSXr7ud3CmyoH40bcfbcHOjYGRQalMeb20kwBbzyh2yAVNv-giIvTASw,,Sangat membatu,Google Play,BNI Call,1
30,alita balgis,https://lh3.googleusercontent.com/a-/AOh14Gi_qLtlSsN-W9NzBVfKbu_fBkBPZ_PzddAmiycbHg,7/8/2020 13:51,1,1,https://play.google.com/apps/publish?#ReviewDetailsPlace:p=id.co.bni.bnicall&reviewid=gp:AOqpTOF4s2ONcQvA7bqOTQyLCp_xB_ohwxVo3tr_IqRBOAAD-51FUH_-37Bp3uJNwsA8qMnF1CUZuPLYsQKbrkw,,"Kok ga membantu ya , maaf , nanya apa dan jawabnya apa , ini mah chatting sama robot",Google Play,BNI Call,0
31,Agusdimas Kurniawan,https://lh3.googleusercontent.com/a-/AOh14GjLok6i5nYOIcj4zJ1OoNEv_zHgTN7fo8efj-b_0g,6/28/2020 4:33,1,1,https://play.google.com/apps/publish?#ReviewDetailsPlace:p=id.co.bni.bnicall&reviewid=gp:AOqpTOFUmHcc7PGNSzKQk4AG-UAEnK4nui79jZ9_iS7ro8cfJ_Hd8jOm-sRjEqYNOwqDFtn_RJR7aXLyYOAzLYw,,Seringkali gagal debet . Tf gagal tapi saldo berkurang .,Google Play,BNI Call,0
32,Radhika Bimantara,https://lh3.googleusercontent.com/-RBfaU4GI5ec/AAAAAAAAAAI/AAAAAAAAAAA/AMZuucmDCKpjsUF9pFuMt_AmoRuyrg5nHw/photo.jpg,6/17/2020 6:49,4,4,https://play.google.com/apps/publish?#ReviewDetailsPlace:p=id.co.bni.bnicall&reviewid=gp:AOqpTOGt8kjvc12BVYBacsttLoTfxPIShqYNDNc4Nc037TVkKswOqwgDmwfHvjxNxoeq09ncp_44-du-iz5lGyk,,Merekomendasikan,Google Play,BNI Call,1
33,Deo Panggabean,https://lh3.googleusercontent.com/a-/AOh14Gg4fNzOJbqlP10FPHtnBeXoI2wQ3yESfB0gUBPVHQ,6/4/2020 16:11,1,1,https://play.google.com/apps/publish?#ReviewDetailsPlace:p=id.co.bni.bnicall&reviewid=gp:AOqpTOFWm0rXYH20S_rt8mLWFCSE4QFSbB4i6kwb1jhYVRnS_9NCIHPRq6Lv8romyIjGbWQF_ppM61RyDlg43-A,,Aplikasi gak berguna,Google Play,BNI Call,0
34,Juandi Sitohang,https://lh3.googleusercontent.com/-0zsjGmP4vBY/AAAAAAAAAAI/AAAAAAAAAAA/AMZuucnorJHQX3LO7OAmxLY1SqFxl4tHWw/photo.jpg,6/3/2020 11:06,1,1,https://play.google.com/apps/publish?#ReviewDetailsPlace:p=id.co.bni.bnicall&reviewid=gp:AOqpTOHA9y1eUN95V3CPoXMWg7PG9lQ3MU1H1bI6pJ3dHKvuL4yXn6h-qRaXOLofCWQ8PAopW0vneuF3iGCHVLg,,"Sudah ketik ""Live chat"" terus nunggu lama, tapi gak ada customer service yang bales, lamaaa bangetttt, tapi GAK ADAAA!!!... Padahal saya coba di jam kerja.. Anda merasa hidup ada tidak berguna?.. Coba lihat aplikasi ini..",Google Play,BNI Call,0
35,andrew why,https://lh3.googleusercontent.com/-bqOQMfzQuOA/AAAAAAAAAAI/AAAAAAAAAAA/AMZuuckYmY1wuJflsb-BrrVob2GEmh7LbA/photo.jpg,6/1/2020 11:28,1,1,https://play.google.com/apps/publish?#ReviewDetailsPlace:p=id.co.bni.bnicall&reviewid=gp:AOqpTOFTrytbNxbkn2jXXgDszSEsXc2ixxBKJbcHrpnIeLAp14bvvkT8yOnFIR3hatjClmUb33Lwn0fFXiANS4M,,"parahhh, bikin habis pulsa data untuk download aplikasi ini... tidak sesuai harapan....",Google Play,BNI Call,0
36,zLEe Official,https://lh3.googleusercontent.com/a-/AOh14GjAZ0Ka1zNB7CWTJjOwrIROOXpAs2OuEx_1QUt_PA,5/31/2020 9:38,1,1,https://play.google.com/apps/publish?#ReviewDetailsPlace:p=id.co.bni.bnicall&reviewid=gp:AOqpTOH1c16yHb4UJ8IfUynu5qC_j6unMFXu3fGI-pz-yY9SK3qLsVIBz3pUz-dJDuxyTa5oMc1tFVsaC1QItd4,,"M-Banking nya lgi knpa ya ? , Kok saya login gak bisa"" , udh masukan username dan password dengan benar namun ketika pencet login , hanya stuck di layar loading doang , gak masuk"" , ini knpa yaa tolong bantuan nya",Google Play,BNI Call,0
37,Yusuf Muhammad,https://lh3.googleusercontent.com/-jBJCEPAtdYc/AAAAAAAAAAI/AAAAAAAAAAA/AMZuucmXdO_UkCnIWFuPMBzkzfPoGNE2ZA/photo.jpg,5/30/2020 12:04,1,1,https://play.google.com/apps/publish?#ReviewDetailsPlace:p=id.co.bni.bnicall&reviewid=gp:AOqpTOGc5DDzCwa1SkpJZa--ge9WSJmR53HYAY0YSWwcBYpg1gAfE1mh5TWw-fPWbkDlryz95gAlG0zDwrQSl0Y,,Kurang bagus sy udah donlot nga bisa juga mau buat apa,Google Play,BNI Call,0
38,Hemilda Novianti,https://lh3.googleusercontent.com/a-/AOh14GiiH_OnxZGa_QGzcwASmP3uzaPIZGLs3yLpVQYbiw,5/28/2020 13:56,3,3,https://play.google.com/apps/publish?#ReviewDetailsPlace:p=id.co.bni.bnicall&reviewid=gp:AOqpTOGoKgmYdaF6vw_2YHS7ZziCGT_Lipko486HGbBBiBbO1Ab057sJ2S12uxAQ4vgj1t5ZXrDE_avfd-fGIvI,,Pada saat permintaan lokasi BNI diarea tertentu hanya keluar berikut lokasi terdekat.tdk ada petunjuk lainnya map atau koordinat lokasi,Google Play,BNI Call,0
39,Laziroth,https://lh3.googleusercontent.com/-nOXutS-yo18/AAAAAAAAAAI/AAAAAAAAAAA/AMZuucmSrgA0lpfPq6EtYuzVaZ9kUlcQLw/photo.jpg,5/25/2020 6:46,1,1,https://play.google.com/apps/publish?#ReviewDetailsPlace:p=id.co.bni.bnicall&reviewid=gp:AOqpTOEPp2OgSh99-OP9dedpNioYC5tfIifwJhz5z_6ozc-5lskPs9qLp4iX5ymnUSVmC-Vq4u4ms7XcQgKE4TU,,"Gak guna, chat yg jwb bot, live chat malah temennya bot, bot juga,",Google Play,BNI Call,0
40,Ester 95,https://lh3.googleusercontent.com/-OLNcuTZL1Bw/AAAAAAAAAAI/AAAAAAAAAAA/AMZuucnyN9MSbVsFEJAYZ8g0puNtHCJTFA/photo.jpg,5/24/2020 4:06,5,5,https://play.google.com/apps/publish?#ReviewDetailsPlace:p=id.co.bni.bnicall&reviewid=gp:AOqpTOFi_Kt7lcn3X1QlH-JT9f-Q0sUFNhRrPWe39ugJKDBkm51sgxQ4L-Ru1MfBccSe-Kf8OGusHso_Ba0D4dQ,,"Ass.. Tolong dong kenapa bni call ny gk update tetang produk BNI , pdahal ini sangat membantu,, terima kasih",Google Play,BNI Call,0
41,Idham Frizzy,https://lh3.googleusercontent.com/-9v05nij2-Kc/AAAAAAAAAAI/AAAAAAAAAAA/AMZuucm1FghsgmEs5eDCoM1BHIVyXHX0GA/photo.jpg,5/21/2020 15:20,1,1,https://play.google.com/apps/publish?#ReviewDetailsPlace:p=id.co.bni.bnicall&reviewid=gp:AOqpTOF6vIMIi-ssAkR4_zB8QM7z9KmCxJLmq2uQ8Ll5hrlPvx6ViKMu-3dVDNZxzPuc5vwf2KfrKWINZb9GnlU,,Aplikasi tak berguna,Google Play,BNI Call,0
42,amy july,https://lh3.googleusercontent.com/-lbGA6t0N0Kc/AAAAAAAAAAI/AAAAAAAAAAA/AMZuucmWvF_y9eJWBmhDzYeaDrCxLUeNFA/photo.jpg,4/30/2020 8:50,1,1,https://play.google.com/apps/publish?#ReviewDetailsPlace:p=id.co.bni.bnicall&reviewid=gp:AOqpTOHA3XtwFHY_yZXge3QiobQqbobpumKdw88Enx5VR7ouKn4xscAqODCLGPQYlHkd5SIMcULFqQkTGshozWE,,"Saya download app ini biar bisa mengajukan keluhan karna saya top up tap cash melalui m banking saldo tap cash saya tidak bertambah tapi saldo di rek saya tetap terpotong, ternyata app ini dijawab sama mesin juga, ditanya lain jwabnya malah cara top up, tolong solusinya pihak BNI ?",Google Play,BNI Call,0
43,Herlina Sorayasita,https://lh3.googleusercontent.com/a-/AOh14GiH8KqkKQ3v1789xKt-G35AZJM-hJZEULuWaCtq,4/28/2020 0:32,1,1,https://play.google.com/apps/publish?#ReviewDetailsPlace:p=id.co.bni.bnicall&reviewid=gp:AOqpTOHwBhSV-fAKhUW93siw3Ajh_O10hvqfDu9XCOcyvw4SUZD-FeIcokkyz03PaMJF8kXx2EN69sEhUeW88p8,,Yg di tanya in apa yg di jawab apa. Gk nyambubg banget pokok nya jawaban yg aku tanyain.,Google Play,BNI Call,0
44,Mella Syahfitri,https://lh3.googleusercontent.com/a-/AOh14GggnZluyq6QJkLK1rALbYRdKMa456XxCDe0_4Cp,4/25/2020 14:31,5,5,https://play.google.com/apps/publish?#ReviewDetailsPlace:p=id.co.bni.bnicall&reviewid=gp:AOqpTOFpmvzww6WnKpXIrXJReTbgTRDAhSBi1wmf0hZAVL2NdMWcNaOrrjECKrxY-JUNQOALFOwumHy3cYXP3GE,,jika kita tf ke rek yg di blokir apa uang yg kita tf hangus.,Google Play,BNI Call,0
45,Eka Anindita,https://lh3.googleusercontent.com/-Bv6alZGlWps/AAAAAAAAAAI/AAAAAAAAAAA/AMZuucmGlTz1xNpHC3kU3fdufayPTKGlNA/photo.jpg,4/16/2020 1:47,5,5,https://play.google.com/apps/publish?#ReviewDetailsPlace:p=id.co.bni.bnicall&reviewid=gp:AOqpTOHCK25nmqiryC12qjegLfncwpvPkrSRpZbP9yq-cygMPegr7JPNwywSF-21oc3cRjBb3uGRyP3TZagYr14,,Bagus dan keren,Google Play,BNI Call,1
46,Ismail Doang,https://lh3.googleusercontent.com/-izQyYp6JD8M/AAAAAAAAAAI/AAAAAAAAAAA/AMZuucm7_voy6VB3cOIsdBhLNtk3QByYCA/photo.jpg,4/14/2020 10:13,1,1,https://play.google.com/apps/publish?#ReviewDetailsPlace:p=id.co.bni.bnicall&reviewid=gp:AOqpTOFgc3pJneeK7R8LT0xegUy2mDSmmL08M8KH9zxWx6BcrGmnK14CVatU1LHIwiaeEeqlsdO0j3660_jLjbY,,"Setiap kali bertanya jawabannya tidak sesuai dengan apa pertanyaannya,,",Google Play,BNI Call,0
47,Shu æ©ç¦…ä¹¦ Ngising,https://lh3.googleusercontent.com/a-/AOh14GiixxV7hJhxWxhzYQXUypC4F50Y0CuoEaKdprl1jJ4,4/9/2020 15:34,1,1,https://play.google.com/apps/publish?#ReviewDetailsPlace:p=id.co.bni.bnicall&reviewid=gp:AOqpTOGOlJM4VQm1VG6SpopLaldXsXh2UpVcAbWrM7wUvqSoM_nMWMyfpl0wE8_IX0qna8oTefUb-N9Q81JwhKY,,"Tolong bantuanya kembalikan uang saya yg kelebihan pembayaran , saya sudah tidak kerja, umur sudah tua, sudah tlp ke contact senter tidak ada kelanjutan nya saya sangat mohon sekali bantuanya yahh terima kasih",Google Play,BNI Call,0
48,Wetry Hijab,https://lh3.googleusercontent.com/-ZyoJx31OWBM/AAAAAAAAAAI/AAAAAAAAAAA/AMZuucn-oVlHDEBX1-0zAQyozZe1OZzYcw/photo.jpg,4/8/2020 13:44,1,1,https://play.google.com/apps/publish?#ReviewDetailsPlace:p=id.co.bni.bnicall&reviewid=gp:AOqpTOFHcvaXcbRCI1RjVVcZlBO758Slb0Wt1gaZsHnzvX12PoPej6KMq0oddHkDJZaRYuk1RbtBU2TcZEStVtY,,"Ini gimana ya, sudah ada live chat nya atau belum, saya download dan chat balasannya dari komputer , dan saya sudah ke 3 kali ini mengirim uang lewat mbanking BNI dan koneksi terputus langsung uangnya terpotong dari atm saya, dan tidak masuk juga ke rekening yg dituju.. Mohon ini solusinya gimana ya, kenapa begini terus.. Dan lagi, saya pernah telpon ke call center BNI tapi setelah itu saya tetap harus ke Bank BNI, padahal Bank BNI dari tempat saya membutuhkan waktu lebih dari 1 jam.. Tolong..",Google Play,BNI Call,0
49,Sri Yanto,https://lh3.googleusercontent.com/-4n52pJwnR0I/AAAAAAAAAAI/AAAAAAAAAAA/AMZuuclrNLJj6W2HzEOl_HUUSKIn2OAdEw/photo.jpg,4/7/2020 11:57,3,3,https://play.google.com/apps/publish?#ReviewDetailsPlace:p=id.co.bni.bnicall&reviewid=gp:AOqpTOGaQqHCQg4yCKm4ttpAAYzFLTCLxeisriJJ0e0vbAkIOlUI6v58uHaJutN4UdHF61fpV_MY7Vmu638N79Q,,baru pertama kali mencoba.. saran saya sih dubbling suara untuk aplikasi ini di ganti aja.. kurang tertarik dengan suara seperti itu...,Google Play,BNI Call,0
50,Ngapocak,https://lh3.googleusercontent.com/a-/AOh14GihpCOGg3CdKkulG6WfAnkOCKxcLW1Y6eKiR4kxdw,3/19/2020 12:15,2,2,https://play.google.com/apps/publish?#ReviewDetailsPlace:p=id.co.bni.bnicall&reviewid=gp:AOqpTOFauLyywAV6VTwV_Hd-PyfhVScj2NTl4oYB4J7qnzU4QzyOm6dMErwpV01dT3USeCukztuquzyxbtlXK_s,,Tolong bni call di update produk bni. Bunga deposito masih bunga lama. Penjelasan bni taplus tidak ada,Google Play,BNI Call,0
51,Endon Ogan,https://lh3.googleusercontent.com/a-/AOh14GgoQrN-c-TuNWNsCU1ZZfqI3oTCTgkqGiNgX2hUhA,3/18/2020 19:31,1,1,https://play.google.com/apps/publish?#ReviewDetailsPlace:p=id.co.bni.bnicall&reviewid=gp:AOqpTOHsQB-G20CSVugUOoxXceU3DWduePi_ai_p4zPlVqJc-ULSETlmcZmgD2H7N-JN52MMWnl__4gKrggSHTw,,Sya sudah download app Internet banking dan mendaftarnya lewat ATM..terus sya cek di app BNI mobile Banking.. disuruh masukkan ID. & Nomor kartu debit.. pas di clik..ID atau no debit atm saya salah.. macam mna BNI ini.. makin kau update aturan baru.. masih dibikin susah konsumen dan nasabah. Parah.,Google Play,BNI Call,0
52,erna wati,https://lh3.googleusercontent.com/-i6S8XRJWA9k/AAAAAAAAAAI/AAAAAAAAAAA/AMZuuclx4-78aN53wLignxzdCTuWQdpo3g/photo.jpg,2/26/2020 9:59,4,4,https://play.google.com/apps/publish?#ReviewDetailsPlace:p=id.co.bni.bnicall&reviewid=gp:AOqpTOFIOcOGxZX2ixlX9nSq3ydocjrKTpER7U3rOUiwzX8J42KFCWmYbkgy9Y9lNVdp-cl5rPdQHJoXk_oTCEs,,Kenapa iya kartu ATM BNI saya tidak bisa transfer dan tidak bisa penarikan uang padahal pin saya benar aja...tolong info nya,Google Play,BNI Call,0
53,Muhamad Lutfi,https://lh3.googleusercontent.com/-8FIn2-X0xBk/AAAAAAAAAAI/AAAAAAAAAAA/AMZuucmtZO-tPCUKkNqRH7-JVy6OJYLjNg/photo.jpg,2/23/2020 9:42,5,5,https://play.google.com/apps/publish?#ReviewDetailsPlace:p=id.co.bni.bnicall&reviewid=gp:AOqpTOHkQHaGFTMMeOx54lN8g1zpNnxqUofVoRFEAAqgdmF2Fv_w7hrlVlYxRLjxZ3DvghfYXFFNCCET8p07n4g,,selamat sore... saya mau tanya sudah 5hari yg lalu saya di tlp katanya dari pihak BNI utk bikin kartu kridit apa itu benar karna saya tidak mau memberi data kalau bukan dari pihak BNI nya langsung,Google Play,BNI Call,1
54,Yusuf 088,https://lh3.googleusercontent.com/a-/AOh14GhY6BkLKBzItABPAwX_dJBBuTQbdd-3Dd-3RQBr,2/21/2020 5:39,1,1,https://play.google.com/apps/publish?#ReviewDetailsPlace:p=id.co.bni.bnicall&reviewid=gp:AOqpTOEmtBTRhCYbS82jvVlpnwiM-9m6X4uefoMZyQfPI6I3uL72AIPyNz4xmDcLZ80BEvji8aGNXZtUUT5FfSc,,"Super2 sangat kecewa saya sm CS BNI pengaduan lbh dari 1 bln cm di jawab dlm proses penyelesaian tp tidak ada tindakan ampe tiap 3hr skali sy tlp ke CS sm saja jwbnnya sprti menyepelekan nasabah kecil gara2 narik uang 2jt yg kluar cm 900rb ank sy tdk bisa byr buat ujian sekolah ,,kecewa saya sm BNI,,,tolong Pihak BNI proses pengaduan nasabah kecil jgn hy melayani yg besar saja,,1 jt itu sangat berarti buat saya CS sllu bilang dlm proses tp gk ada kepastian,,,ampe capek sy di php trs CS",Google Play,BNI Call,0
55,Nopiansyah Acok,https://lh3.googleusercontent.com/--ztF9poIf1Y/AAAAAAAAAAI/AAAAAAAAAAA/AMZuuclD-nx4Cz-d0-iBCz2ejkduux8jMw/photo.jpg,2/17/2020 15:07,5,5,https://play.google.com/apps/publish?#ReviewDetailsPlace:p=id.co.bni.bnicall&reviewid=gp:AOqpTOFlUAFBp_AjstbOfB8ukYRMerBJeH0qmXCUaWkHYqI-2Inol9gPD8PbB1kpDptt0UFO0edKw10gAWI9aZ8,,Tolong bos diperoseakan saldo temen saya yg tarik uang uang tidak keluar SD 6 hari.,Google Play,BNI Call,0
56,Liestina Nuraini,https://lh3.googleusercontent.com/-qzETUrwjYt4/AAAAAAAAAAI/AAAAAAAAAAA/AMZuucmBuO_0e6EDE19d8z3f9rRJznPxNQ/photo.jpg,2/10/2020 9:08,1,1,https://play.google.com/apps/publish?#ReviewDetailsPlace:p=id.co.bni.bnicall&reviewid=gp:AOqpTOE-wZ648KwtP4A6moolyitpJtR_UF9fBcc5gZpeDSNZFXEQ7i8zHU6R5pnMh0S23PHUelxMI9cC7wqOXPs,,Sumpah aplikasi bot sampah. Download ini krn bingung otp mbanking tdk masuk masuk trs gbs log in. Malah ga guna banget.,Google Play,BNI Call,0
57,Imam Safii,https://lh3.googleusercontent.com/-WjKpLzRf2o8/AAAAAAAAAAI/AAAAAAAAAAA/AMZuuclSs6Y_QAERTsfxlJki_NgvLR6tAA/photo.jpg,2/5/2020 8:51,1,1,https://play.google.com/apps/publish?#ReviewDetailsPlace:p=id.co.bni.bnicall&reviewid=gp:AOqpTOEWfk1ogi4nD_8hPcBiNDNURqFhEANfoCpCHInHtKUga0Vme1532UINkH9AQssVDFfAf917GJzf4R6bfsQ,,"Saya download aplikasi ini karena saya transfer ke rekening temen, saldo saya kepotong tapi uangnya belom sampai ke temen saya, saya cabang bni terdekat CS nya bilang tunggu 14 hari kerja, gila ya BNI emang di pikir cicilan gw bisa nunggu 14 hari, mau ga mau denda cicilan saya yang nanggung, pihak BNI tolong lah saya kecewa dengan pelayanan BNI",Google Play,BNI Call,0
58,ika purwanti,https://lh3.googleusercontent.com/-VbbTW1XTY5E/AAAAAAAAAAI/AAAAAAAAAAA/AMZuucmzEiwi6sVFJ0Q5S545DFcheTugtg/photo.jpg,1/15/2020 5:53,5,5,https://play.google.com/apps/publish?#ReviewDetailsPlace:p=id.co.bni.bnicall&reviewid=gp:AOqpTOG4PUtBYcbTxxy6aMbsH0GTlGFw9dpoUu70p11RmusHE4-YayG5p-iKr2imBqdNvHwBQf1JUxxrB5u0-WM,,saya kasi 5 bintang apakah tanpa npwp bisa mengajukan pinjaman.. saya nasabah bni syariah,Google Play,BNI Call,1
59,Yusuf .S,https://lh3.googleusercontent.com/-WYpjn7HgaCw/AAAAAAAAAAI/AAAAAAAAAAA/AMZuucnS0JSrOcK2NU1AHOzeLo8A8DIsMA/photo.jpg,1/7/2020 10:40,4,4,https://play.google.com/apps/publish?#ReviewDetailsPlace:p=id.co.bni.bnicall&reviewid=gp:AOqpTOETjDrlPAWgmGbax5jWtRV-ygQYINjAx0138yWAxpUn4RVBPJSKnE3rUb223YatWPDbcBagN7gIL47D7Rc,,Kirain live chat ternyata cuman BOT gk berguna.,Google Play,BNI Call,0
60,Iqbal Libryantoro,https://lh3.googleusercontent.com/a-/AOh14GgGTz8c5S-94ZrrtAx9O0kvGwQyqT5WnqpgPHmi1w,12/27/2019 5:02,1,1,https://play.google.com/apps/publish?#ReviewDetailsPlace:p=id.co.bni.bnicall&reviewid=gp:AOqpTOGQD8Dl5ujSzDZRQHDsmUMQgodHSvt0al5Fe0RKpHvO02_DmUwDJbFBJDg8nOgb5UjLuX7mvVu_Kqh3_qc,,"Isinya bot, minta live chat boro2 bisa connect. App sampah",Google Play,BNI Call,0
61,Indri .co. I',https://lh3.googleusercontent.com/-5U5E3qM5OWU/AAAAAAAAAAI/AAAAAAAAAAA/AMZuucnBjwnPmAt07Mnfl2FKuZCNk7GkjA/photo.jpg,12/23/2019 5:14,3,3,https://play.google.com/apps/publish?#ReviewDetailsPlace:p=id.co.bni.bnicall&reviewid=gp:AOqpTOHbz5rF1c6JXhQVsUw6FI_l_DNy5VdAKTuR8mPenGzNbWd7Iw4Ms7m-Pl4xMZQ_NAbeASBVSN5ifCs7VIk,,Baguus,Google Play,BNI Call,1
62,Haryo Poentodewo,https://lh3.googleusercontent.com/a-/AOh14Gi_5o2zgdB4Dyjpjzv7kWeqNzu-MpBulWt9pNu7,11/20/2019 18:18,5,5,https://play.google.com/apps/publish?#ReviewDetailsPlace:p=id.co.bni.bnicall&reviewid=gp:AOqpTOHogX44C27pbakU-50XZotX7nCNRwAGKcufBspeRA2Vpuyd0-KT4udfWvA3rT5MEUUzL5ZxqPgXpBcTXLo,,"Saya suka ini, layanan yang baik dapat lebih mengenalkan kita pada kondisi keuangan yang lebih bermanfaat serta tepat guna. Trimakasih BNI",Google Play,BNI Call,1
63,Aji Teguh Wijayanto,https://lh3.googleusercontent.com/a-/AOh14GiU2zoieu-fxv7n9TplkKpBdKObCssrAtTJhFbI,11/13/2019 12:57,1,1,https://play.google.com/apps/publish?#ReviewDetailsPlace:p=id.co.bni.bnicall&reviewid=gp:AOqpTOHo9ZKmKGW0EB7y-7SUJFLC4B0S_nF8Zn-3Ny4nGQCTogeGpT2pKuFetTph24o0hlgVYKGh48iCt5ddEuE,,Tk kira simple....bot lagi....,Google Play,BNI Call,1
64,Wahyu Tri S.,https://lh3.googleusercontent.com/a-/AOh14GiYVUIGMImOs8CwxNgil9gGMWviPEKf8Tb9YSIM8Vk,10/14/2019 2:25,1,1,https://play.google.com/apps/publish?#ReviewDetailsPlace:p=id.co.bni.bnicall&reviewid=gp:AOqpTOHDxT10nq3oWoit7oiR_IdZBAh6ngPoyAUaaL9osvlN4674XUsV5GcE0Wm8BUcAwW5QfybLjT4l0rGJX-I,,"Aplikasi ini useless. Jawabannya dari bot yang hanya standar2 saja lebih cepat kita cari di google saja. Kita butuh solusi dan aplikasi ini hanya hiasan saja. Kita butuh solusi pasti seperti fitur Live Chat atau Telpon Customer Service via VOIP #Note: Bagi admin yang reply ulasan ini tolong bikin saran/keluhan/kritik ke tim developer/yang punya ide utk aplikasi BNI ini. Tambahan: Tolong sebelum memberikan saran dicoba dulu sendiri, ketik ""Bicara dengan petugas"" tidak membawa langsung ke live chat",Google Play,BNI Call,0
65,Abdul Hadi Eswanto,https://lh3.googleusercontent.com/a-/AOh14GiEXjqzLfmoCDpGeTg9XhWHhxJWVE5omXuxqCHBbtc,10/2/2019 12:46,5,5,https://play.google.com/apps/publish?#ReviewDetailsPlace:p=id.co.bni.bnicall&reviewid=gp:AOqpTOF0paPHKib5qVGEQ6fFFag1YyI9wLiUx1TFK7ojPNuyEJknxzhh6fTo2usYSTCDQf3f7-FHE-OOeXa1F4E,,"Sangat terbantu dengan aplikasi ini, bisa jadi teman dalam belajar juga. Semoga bisa ditambah dengan fitur fitur terbaru",Google Play,BNI Call,1
66,LENDRA HARYO SENO,https://lh3.googleusercontent.com/a-/AOh14GirCdn5rhIYOzQjABswAtJtKFphQMNSr6cIeg14FA,9/23/2019 1:31,5,5,https://play.google.com/apps/publish?#ReviewDetailsPlace:p=id.co.bni.bnicall&reviewid=gp:AOqpTOGQyL55hRfCI7ni5uCnAZ-H_u_gZZQLaY7cnXpQ7mZ_fV-nJhvpjNcdkHuAtwn5dcTtI1TGdTeR-PSDSaU,,good,Google Play,BNI Call,1
67,Febrina Setyowati,https://lh3.googleusercontent.com/-exm2yh9PgB8/AAAAAAAAAAI/AAAAAAAAAAA/AMZuucm1jeHB-iHKSvXtyRdidwALFSJrcw/photo.jpg,8/30/2019 1:35,4,4,https://play.google.com/apps/publish?#ReviewDetailsPlace:p=id.co.bni.bnicall&reviewid=gp:AOqpTOFMgM3t53L4xkl_0J7CN8i7NfCAwnX6J49-uyHCVbbov25kbgG8o96v2n7E0ZYUETlqZxV_kuQCrhrh4zQ,,bagus utk.belajar,Google Play,BNI Call,1
